{
 "canonical": {
  "chapter": 139,
  "entities": [
   "支配之王",
   "相川涡波",
   "艾德"
  ],
  "name": "涡波与千年前之王的旧怨（诓骗指控）",
  "note": "据艾德：'忘掉你诓骗了我等的王这件事好了'——涡波〔或其前世〕千年前欺骗守护者之王的罪嫌；涡波对艾德毫无记忆（帕林库洛记忆夺取背景），指控真伪与内情未解；与涡波千年存在之谜（ch131『我到底是谁』）同轨",
  "payoff_chapter": null,
  "setup_chapter": 139,
  "tier": "核心"
 },
 "evidence": [
  {
   "chapter": 139,
   "line": 30,
   "quote": "「诶诶，没错正是如此。一切都已经结束了。因此就忘掉你诓骗了我等的王这件事好了。都是过去的事情了，已经与现在无关了啊」",
   "vol": 1
  }
 ],
 "library": "foreshadow",
 "observations": [
  {
   "category": "foreshadowing",
   "chapter": 139,
   "text": "千年罪嫌钩（再演重申）"
  }
 ],
 "provenance": {
  "extractor": "glm-zcode-agent-v1（工单v1.2§0亲抽路线）",
  "extractor_confidence": 0.85,
  "gate_trace": [],
  "precedent_refs": [],
  "status_history": [
   {
    "by": "promotion",
    "from": "candidate",
    "to": "provisional"
   }
  ]
 },
 "record_id": "cand-foreshadow-9f6cf0c4f3b2",
 "record_type": "foreshadow",
 "status": "provisional",
 "supersedes": null,
 "verified_against": {
  "path": "D:/zcode专用！！！！危险！！！！！！！！！/正典库构建系统/迷深实战-工作区/slice/ch0139.txt",
  "sha": "27947dd70d40c87032cc8b9d0a47b9b081343da8ba9dc87ca551f015961d0b1b",
  "verified_at": "2026-09-19"
 },
 "version": 1
}