{
 "canonical": {
  "claim": false,
  "object": "『Foam』",
  "rel_type": "习得",
  "subject": "相川涡波"
 },
 "evidence": [
  {
   "chapter": 13,
   "line": 1031,
   "quote": "「总之让我先试试好了。——魔法『Foam』。」",
   "vol": 1
  }
 ],
 "library": "relation",
 "observations": [
  {
   "category": "relation",
   "chapter": 13,
   "text": "同批习得（次元目录仅两种全购）；泡沫=次元扭曲之独知"
  }
 ],
 "provenance": {
  "extractor": "glm-zcode-agent-v1（工单v1.2§0亲抽路线）",
  "extractor_confidence": 0.9,
  "gate_trace": [],
  "precedent_refs": [],
  "status_history": [
   {
    "by": "promotion",
    "from": "candidate",
    "to": "provisional"
   }
  ]
 },
 "record_id": "cand-relation-141c18d567d1",
 "record_type": "relation",
 "status": "provisional",
 "supersedes": null,
 "verified_against": {
  "path": "语料分析/corpus/clean_full.txt",
  "sha": "e1a96061d25b0016094dd8daec82769ee80fc3bb",
  "verified_at": "2026-09-16"
 },
 "version": 1
}