{
 "canonical": {
  "entity_type": "人物(迷宫生物)",
  "name": "锯齿甲虫"
 },
 "evidence": [
  {
   "chapter": 4,
   "line": 634,
   "quote": "是锯齿甲虫。",
   "vol": 1
  }
 ],
 "library": "setting",
 "observations": [
  {
   "category": "summary",
   "chapter": 4,
   "text": "瓦尔德一层常见敌（昆虫系居多）；组队首战对象，被缇亚『火焰箭』一击必杀（L634-662）"
  }
 ],
 "provenance": {
  "extractor": "glm-zcode-agent-v1（工单v1.2§0亲抽路线）",
  "extractor_confidence": 0.9,
  "gate_trace": [],
  "precedent_refs": [],
  "status_history": [
   {
    "by": "promotion",
    "from": "candidate",
    "to": "provisional"
   }
  ]
 },
 "record_id": "cand-entity-ec0e84af925a",
 "record_type": "entity",
 "status": "provisional",
 "supersedes": null,
 "verified_against": {
  "path": "语料分析/corpus/clean_full.txt",
  "sha": "e1a96061d25b0016094dd8daec82769ee80fc3bb",
  "verified_at": "2026-09-16"
 },
 "version": 1
}