{
 "canonical": {
  "chapter": 200,
  "fact": "罗德的武器：刃枪两用（可持刃交锋亦可枪口射击）；枪击子弹会爆炸但穿透力不强、被城墙挡下；可解除形态空出右臂",
  "name": "铳剑",
  "tick": 200
 },
 "evidence": [
  {
   "chapter": 200,
   "line": 4,
   "quote": "我一边咋舌一边挥剑架开罗德的铳剑。",
   "vol": 1
  },
  {
   "chapter": 200,
   "line": 151,
   "quote": "罗德拉开距离将铳剑的枪口冲向我。",
   "vol": 1
  },
  {
   "chapter": 200,
   "line": 155,
   "quote": "不过子弹却被挡在城墙外爆炸了。",
   "vol": 1
  },
  {
   "chapter": 200,
   "line": 161,
   "quote": "就看到她解除了铳剑的形态",
   "vol": 1
  }
 ],
 "library": "setting",
 "observations": [
  {
   "category": "knowledge",
   "chapter": 200,
   "text": "武器形态与子弹性质（本章详述）"
  }
 ],
 "provenance": {
  "extractor": "glm-zcode-agent-v1（工单v1.2§0亲抽路线）",
  "extractor_confidence": 0.85,
  "gate_trace": [],
  "precedent_refs": [],
  "status_history": [
   {
    "by": "promotion",
    "from": "candidate",
    "to": "provisional"
   }
  ]
 },
 "record_id": "cand-setting-4b22363f0e7f",
 "record_type": "setting",
 "status": "provisional",
 "supersedes": null,
 "verified_against": {
  "path": "D:\\zcode专用！！！！危险！！！！！！！！！\\正典库构建系统\\迷深实战-工作区\\slice\\ch0200.txt",
  "sha": "98f6dbae430f8af34510b61143350dec18e0aaeeed656a0879180aedddd1a1b4",
  "verified_at": "2026-09-21"
 },
 "version": 1
}