{
 "canonical": {
  "chapter": 193,
  "fact": "诺斯菲光魔法之核心（原文亦记作『交流（篡改）』）：本章实证其对无意识之『术式』可无条件解决许可与否的问题——光属性魔力沁入『血』中直接与术式交流，令对方魔法双重发动（正反相杀）；对生物侧『不具有强制力』的说法被涡波斥为假（『什么不具有强制力的『交流』都是假的』）；诺斯菲自称『抓住对手的『弱点』再『交流』是和平交涉的基本原则』",
  "name": "交流",
  "tick": 193
 },
 "evidence": [
  {
   "chapter": 193,
   "line": 13,
   "quote": "我对执行召唤的术式进行了『交流（篡改）』，将召唤对象从罗德转变为了我自己",
   "vol": 1
  },
  {
   "chapter": 193,
   "line": 181,
   "quote": "而且因为对象是没有意识的『术式』，所以可以无条件地用『交流』解决许可与否的问题。",
   "vol": 1
  },
  {
   "chapter": 193,
   "line": 241,
   "quote": "「恕我直言。抓住对手的『弱点』再『交流』是和平交涉的基本原则」",
   "vol": 1
  }
 ],
 "library": "setting",
 "observations": [
  {
   "category": "knowledge",
   "chapter": 193,
   "text": "光魔法机制（据诺斯菲言行与涡波战场解析）"
  }
 ],
 "provenance": {
  "extractor": "glm-zcode-agent-v1（工单v1.2§0亲抽路线）",
  "extractor_confidence": 0.9,
  "gate_trace": [],
  "precedent_refs": [],
  "status_history": [
   {
    "by": "promotion",
    "from": "candidate",
    "to": "provisional"
   }
  ]
 },
 "record_id": "cand-setting-eeb2649824fd",
 "record_type": "setting",
 "status": "provisional",
 "supersedes": null,
 "verified_against": {
  "path": "D:\\zcode专用！！！！危险！！！！！！！！！\\正典库构建系统\\迷深实战-工作区\\slice\\ch0193.txt",
  "sha": "25510a28004da1402b8ea44c96e41c6ea1fd3d3fe7163bd7770b2da237999322",
  "verified_at": "2026-09-21"
 },
 "version": 1
}