{
 "canonical": {
  "claim": false,
  "object": "拉丝缇娅拉",
  "rel_type": "人工呼吸接吻(夺吻担责)",
  "subject": "相川涡波"
 },
 "evidence": [
  {
   "chapter": 126,
   "line": 35,
   "quote": "因为方才的意外导致我们双唇相合，这使得拉丝缇娅拉的感情无法避免地高涨了。然而，我却无法跟拉丝缇娅拉现在的感情产生共鸣。",
   "vol": 1
  },
  {
   "chapter": 126,
   "line": 43,
   "quote": "这次可不是拥抱，是接吻啊。也就是Kiss。不管我怎么解释说是人工呼吸，也不是能那么容易就蒙混过去的事情。",
   "vol": 1
  },
  {
   "chapter": 126,
   "line": 44,
   "quote": "既然夺去了身为女孩子的拉丝缇娅拉的吻，那就必须要负起相应的责任。原来世界的价值观不停地责备着我的良心。",
   "vol": 1
  }
 ],
 "library": "relation",
 "observations": [
  {
   "category": "relation",
   "chapter": 126,
   "text": "战斗救溺中双唇相合（=接吻/Kiss——『可不是拥抱』）；涡波持原世界价值观认定『夺去了身为女孩子的拉丝缇娅拉的吻必须负起相应的责任』；拉丝缇娅拉感情因此高涨而涡波无法与之共鸣（『？？？』夺情所致——感情的温差）"
  }
 ],
 "provenance": {
  "extractor": "glm-zcode-agent-v1（工单v1.2§0亲抽路线）",
  "extractor_confidence": 0.9,
  "gate_trace": [],
  "precedent_refs": [],
  "status_history": [
   {
    "by": "promotion",
    "from": "candidate",
    "to": "provisional"
   }
  ]
 },
 "record_id": "cand-relation-efe03503aa60",
 "record_type": "relation",
 "status": "provisional",
 "supersedes": null,
 "verified_against": {
  "path": "迷深实战-工作区/slice/ch0126.txt",
  "sha": "a1bc2d711b1c5d5c5f2940c8f13c814d6ad9261a",
  "verified_at": "2026-09-19"
 },
 "version": 1
}