{
 "canonical": {
  "chapter_ref": 84,
  "day_offset": 68,
  "instant": null,
  "kind": "pseudo",
  "label": "第84章伪锚点",
  "parent_anchor": null,
  "precision": "day",
  "pseudo_date": "2000-03-09",
  "tick": 68
 },
 "evidence": [
  {
   "chapter": 84,
   "line": 0,
   "quote": "<<<CHAPTER 0084 | …>>>",
   "vol": 1
  }
 ],
 "library": "timeline",
 "provenance": {
  "extractor_confidence": 1.0,
  "gate_trace": [],
  "precedent_refs": [],
  "status_history": [
   {
    "by": "promotion",
    "from": "candidate",
    "to": "provisional"
   }
  ]
 },
 "record_id": "anchor-v01c0084",
 "record_type": "anchor",
 "status": "provisional",
 "supersedes": null,
 "verified_against": {
  "path": "语料分析/corpus/clean_full.txt",
  "sha": "e1a96061d25b0016094dd8daec82769ee80fc3bb",
  "verified_at": "2026-09-18"
 },
 "version": 1
}