{
 "canonical": {
  "entity_type": "组织(佩艾希亚·千年前王国近卫)",
  "name": "王近卫骑士团"
 },
 "evidence": [
  {
   "chapter": 195,
   "line": 21,
   "quote": "「──请不要小看我们，我们乃荣耀的『王近卫骑士团』的一员。就算对手是团长殿下，也别想轻易从这里通过。」",
   "vol": 1
  },
  {
   "chapter": 195,
   "line": 20,
   "quote": "从左边到右的级别依次为27，24，28，24──五人都是可以和我比肩的高级别人员。",
   "vol": 1
  },
  {
   "chapter": 195,
   "line": 24,
   "quote": "这礼仪端正的姿态和那份强大的实力，让我不由的想起地上的『天上的七骑士』。",
   "vol": 1
  },
  {
   "chapter": 195,
   "line": 42,
   "quote": "绝对不会一人冒前突进，比起武人的矜持更重要的是将胜利拿到手。只为胜利而行动，是『陷入困境的我』惯用的手法。",
   "vol": 1
  },
  {
   "chapter": 195,
   "line": 58,
   "quote": "他们到昨天为止还作为魔石漂浮在天空。和平的世界不需要带剑的骑士，这也是理所当然的。",
   "vol": 1
  }
 ],
 "library": "setting",
 "observations": [
  {
   "category": "summary",
   "chapter": 195,
   "text": "千年前传说时代的骑士团；本章登场其五名男性兽人剑士（护臂+铠甲武装；从左到右级别依次27/24/28/24、五人皆可与涡波比肩，『素质』不俗），礼仪端正、有战火中生存的人类特有的威压感；拒听涡波一切话语（「你的话语有着特别的力量⋯⋯我们并没有判断其真伪的能力⋯⋯虽然想听⋯⋯但却不能听」）、任务至上，对团长执行『断罪』；另有新人兽人骑士在街道巡逻（称涡波「背叛的骑士」）"
  },
  {
   "category": "summary",
   "chapter": 195,
   "text": "战法：贯彻多数对少数的同时攻击（「绝对不会一人冒前突进，比起武人的矜持更重要的是将胜利拿到手」）——涡波从战法反推其剑术教官正是自己；成员到昨天为止还作为魔石漂浮在佩艾希亚天空、由罗德/诺斯菲扭曲时间轴唤回现世；现任团长代理=伊丽莎白・沃尔斯（据骑士）"
  }
 ],
 "provenance": {
  "extractor": "glm-zcode-agent-v1（工单v1.2§0亲抽路线）",
  "extractor_confidence": 0.95,
  "gate_trace": [],
  "precedent_refs": [],
  "status_history": [
   {
    "by": "promotion",
    "from": "candidate",
    "to": "provisional"
   }
  ]
 },
 "record_id": "cand-entity-ca4559429ed2",
 "record_type": "entity",
 "status": "provisional",
 "supersedes": null,
 "verified_against": {
  "path": "D:\\zcode专用！！！！危险！！！！！！！！！\\正典库构建系统\\迷深实战-工作区\\slice\\ch0195.txt",
  "sha": "c0c2a126a6abf5d026ad11bfbc1ff920661ba03f8f132dbbf365a67fc559f68e",
  "verified_at": "2026-09-21"
 },
 "version": 1
}