{
 "canonical": {
  "entities": [
   "大圣堂",
   "本土",
   "相川涡波",
   "相川阳滝",
   "缇亚",
   "缇缇",
   "艾德"
  ],
  "instant": null,
  "kind": "方针",
  "name": "北方行目标确立",
  "tick": 216,
  "time_verbatim": "出发当日晨"
 },
 "evidence": [
  {
   "chapter": 216,
   "line": 10,
   "quote": "「来吧，目标是本土！前往艾德等人所在的『北方』──」",
   "vol": 1
  },
  {
   "chapter": 216,
   "line": 24,
   "quote": "去和同伴们汇合，然后救回缇亚和阳滝，解决了这些之后再做好万全的准备前往大圣堂，在那里一雪前耻。",
   "vol": 1
  }
 ],
 "library": "event",
 "observations": [
  {
   "category": "event",
   "chapter": 216,
   "text": "涡波宣布目标本土『北方』（艾德等人所在）；行程序次——与同伴汇合→救回缇亚和阳滝→万全准备后赴大圣堂一雪前耻；分秒必争推进"
  }
 ],
 "provenance": {
  "extractor": "glm-zcode-agent-v1（工单v1.2§0亲抽路线）",
  "extractor_confidence": 0.88,
  "gate_trace": [],
  "precedent_refs": [],
  "status_history": [
   {
    "by": "promotion",
    "from": "candidate",
    "to": "provisional"
   }
  ]
 },
 "record_id": "cand-event-85c2ceb25aca",
 "record_type": "event",
 "status": "provisional",
 "supersedes": null,
 "verified_against": {
  "path": "D:\\zcode专用！！！！危险！！！！！！！！！\\正典库构建系统\\迷深实战-工作区\\slice\\ch0216.txt",
  "sha": "1489190fc5bab97510c2211cd4bb0e90808e0c621cc25be8628748c9eff91065",
  "verified_at": "2026-09-22"
 },
 "version": 1
}