{
 "canonical": {
  "chapter": 191,
  "entities": [
   "相川涡波",
   "罗德"
  ],
  "name": "罗德的『真正的愿望』与视线错位",
  "note": "罗德坐上玉座道谢'人家真正的愿望似乎终于能够实现了呐'、摆弄翠绿色长发姿态成熟——涡波'毛发倒竖''背嵇发凉'、总评'尽管没有失败，但也不算成功'；章末直书'罗德的眼中虽然闪出了希望的光辉，但她看的根本不是我'——其所望非涡波；且与其'继续生活下去就会消失'/'佩艾希亚的和平就是最期望'的自述表面矛盾——真意是否即接引计划=本章最大开环",
  "payoff_chapter": null,
  "setup_chapter": 191,
  "tier": "核心"
 },
 "evidence": [
  {
   "chapter": 191,
   "line": 157,
   "quote": "「嗯，一路走好。另外，非常感谢你，涡・波⋯⋯拜你所赐，人家真正的愿望似乎终于能够实现了呐⋯⋯」",
   "vol": 1
  },
  {
   "chapter": 191,
   "line": 166,
   "quote": "尽管没有失败，但也不算成功──我不禁这样想道。",
   "vol": 1
  },
  {
   "chapter": 191,
   "line": 246,
   "quote": "罗德的眼中虽然闪出了希望的光辉，但她看的根本不是我。",
   "vol": 1
  }
 ],
 "library": "foreshadow",
 "observations": [
  {
   "category": "foreshadowing",
   "chapter": 191,
   "text": "罗德真意钩（与F2/F6连链）"
  }
 ],
 "provenance": {
  "extractor": "glm-zcode-agent-v1（工单v1.2§0亲抽路线）",
  "extractor_confidence": 0.93,
  "gate_trace": [],
  "precedent_refs": [],
  "status_history": [
   {
    "by": "promotion",
    "from": "candidate",
    "to": "provisional"
   }
  ]
 },
 "record_id": "cand-foreshadow-d123bdc23382",
 "record_type": "foreshadow",
 "status": "provisional",
 "supersedes": null,
 "verified_against": {
  "path": "D:\\zcode专用！！！！危险！！！！！！！！！\\正典库构建系统\\迷深实战-工作区\\slice\\ch0191.txt",
  "sha": "3d7d9970638c17ac2726a56f553b22de08bb6695509905f075cb6153b5f2cb11",
  "verified_at": "2026-09-21"
 },
 "version": 1
}