{
 "canonical": {
  "entities": [
   "相川涡波",
   "罗德·缇缇",
   "诺斯菲"
  ],
  "instant": null,
  "kind": "约定",
  "name": "真留恋判明=说任性的话·任性委托",
  "tick": 92,
  "time_verbatim": "深夜"
 },
 "evidence": [
  {
   "chapter": 92,
   "line": 310,
   "quote": "「嗯。呵呵，简要来说的话，我想要的也就是让涡波大人听我说些任性的话而已吧。」",
   "vol": 1
  },
  {
   "chapter": 92,
   "line": 316,
   "quote": "我的愿望不过只是『说任性的话』罢了，没错，我的愿望仅此而已。」",
   "vol": 1
  },
  {
   "chapter": 92,
   "line": 332,
   "quote": "「那请您听我说句任性的话吧。如果可以，能否请您让我的『朋友』罗德恢复精神呢？",
   "vol": 1
  },
  {
   "chapter": 92,
   "line": 336,
   "quote": "「可能的话，我想跟罗德和好。因为我和罗德是『朋友』啊。」",
   "vol": 1
  }
 ],
 "library": "event",
 "observations": [
  {
   "category": "event",
   "chapter": 92,
   "text": "诺斯菲自悟：『犯错』只是对『正确的事』的否定、只要去否定就足够；真留恋=让涡波大人听其说任性的话（生前一句任性未说过；索求契约之『证明』实属冒昧）；任性①=请涡波令『朋友』罗德恢复精神（不必说服、至少恢复以往状态）并促成二人和好；解锁全部光棒离去"
  }
 ],
 "provenance": {
  "extractor": "glm-zcode-agent-v1（工单v1.2§0亲抽路线）",
  "extractor_confidence": 0.9,
  "gate_trace": [],
  "precedent_refs": [],
  "status_history": [
   {
    "by": "promotion",
    "from": "candidate",
    "to": "provisional"
   }
  ]
 },
 "record_id": "cand-event-f7e7ecd6a7eb",
 "record_type": "event",
 "status": "provisional",
 "supersedes": null,
 "verified_against": {
  "path": "迷深实战-工作区/slice/ch0092.txt",
  "sha": "c54b7c47b695bb8c4069c72739c4150dd214ba18f7e34258e60cf1ce9146abc2",
  "verified_at": "2026-09-19"
 },
 "version": 1
}