{
 "canonical": {
  "claim": false,
  "object": "基督·欧亚",
  "rel_type": "曾在迷宫救助",
  "subject": "拉丝缇娅拉"
 },
 "evidence": [
  {
   "chapter": 14,
   "line": 95,
   "quote": "虽然我在迷宫中受她相救也是事实",
   "vol": 1
  }
 ],
 "library": "relation",
 "observations": [
  {
   "category": "relation",
   "chapter": 14,
   "text": "主角自述『我在迷宫中受她相救也是事实』，但恐惧感胜过感恩"
  }
 ],
 "provenance": {
  "extractor": "glm-zcode-agent-v1（工单v1.2§0亲抽路线）",
  "extractor_confidence": 0.9,
  "gate_trace": [],
  "precedent_refs": [],
  "status_history": [
   {
    "by": "promotion",
    "from": "candidate",
    "to": "provisional"
   }
  ]
 },
 "record_id": "cand-relation-5ab71c2b4fb9",
 "record_type": "relation",
 "status": "provisional",
 "supersedes": null,
 "verified_against": {
  "path": "语料分析/corpus/clean_full.txt",
  "sha": "e1a96061d25b0016094dd8daec82769ee80fc3bb",
  "verified_at": "2026-09-16"
 },
 "version": 1
}