{
 "canonical": {
  "entities": [
   "『LivingLegend号』",
   "塞拉·雷迪安特",
   "帕林库洛",
   "拉丝缇娅拉",
   "斯诺·沃克",
   "玛利亚",
   "相川涡波",
   "缇亚",
   "莉帕"
  ],
  "instant": null,
  "kind": "出航",
  "name": "LivingLegend号出航与七人甲板誓师(周回二度)",
  "tick": 110,
  "time_verbatim": "深夜出航→黄金色黎明启程"
 },
 "evidence": [
  {
   "chapter": 110,
   "line": 277,
   "quote": "「名字就叫『LivingLegend号』！」",
   "vol": 1
  },
  {
   "chapter": 110,
   "line": 294,
   "quote": "于是『LivingLegend号』开始缓缓地向着海上进发。",
   "vol": 1
  },
  {
   "chapter": 110,
   "line": 307,
   "quote": "随后，总算推断出了向着瓦尔德本土的航路，使航行稳定下来。",
   "vol": 1
  },
  {
   "chapter": 110,
   "line": 311,
   "quote": "至今为止最多也只是三个人组成小队。因此现在这个7人小队使我心情激动。",
   "vol": 1
  },
  {
   "chapter": 110,
   "line": 313,
   "quote": "「大家，我们的目标是瓦尔德『本土』，追赶身在『本土』的帕林库洛。」",
   "vol": 1
  },
  {
   "chapter": 110,
   "line": 328,
   "quote": "并且，我有了同伴，我已经不是一个人了。",
   "vol": 1
  },
  {
   "chapter": 110,
   "line": 340,
   "quote": "在这个宽广的异世界里，我确实不是独自一人──",
   "vol": 1
  },
  {
   "chapter": 110,
   "line": 352,
   "quote": "「──走吧！该出航了！！」",
   "vol": 1
  }
 ],
 "library": "event",
 "observations": [
  {
   "category": "event",
   "chapter": 110,
   "text": "命名『LivingLegend号』（拉丝缇娅拉；塞拉捍卫品味/涡波错过反对时机）→莉帕动力点火+涡波登桅展帆升锚→缓缓进发（初次见海的拉丝缇娅拉与莉帕最兴奋）→交替《Dimension》航海避难/沿陆地航行→推断出瓦尔德本土航路→甲板大桌七人列席（此前最多三人队）→领队宣言目标=瓦尔德『本土』追帕林库洛（缇达魔石/真动机自剥/圣诞祭翻盘）→『大家，请把你们的力量借给我』→全员承诺（拉丝缇娅拉当然论/缇亚玛利亚静怒应诺/斯诺莉帕真拿你没办法/塞拉为了大小姐）→『我确实不是独自一人』→黄金色黎明照海，讴歌启程→『作为相川涡波而生』的开端宣言"
  }
 ],
 "provenance": {
  "extractor": "glm-zcode-agent-v1（工单v1.2§0亲抽路线）",
  "extractor_confidence": 0.9,
  "gate_trace": [],
  "precedent_refs": [],
  "status_history": [
   {
    "by": "promotion",
    "from": "candidate",
    "to": "provisional"
   }
  ]
 },
 "record_id": "cand-event-5cb098b29c15",
 "record_type": "event",
 "status": "provisional",
 "supersedes": null,
 "verified_against": {
  "path": "迷深实战-工作区/slice/ch0110.txt",
  "sha": "9fc0790550d49f0be562deb4d677eef25593d2b8",
  "verified_at": "2026-09-19"
 },
 "version": 1
}