{
 "canonical": {
  "chapter": 119,
  "fact": "33层构造大多是河流和浅滩；与之联动敌人种类变化：矿物系高防怪物减少、水栖系怪物变多；涡波预期'水系的怪物对火焰的耐性应该很强'被实战推翻——'不过就是点水，在压倒性的热量面前没有任何意义'，接触光线瞬间即被彻底蒸发，水栖矿物无异。※与库内 ch0071 记录（33层祭坛群/34层石制回廊覆水及膝）不合，存疑留终审",
  "name": "33层地形与怪物构成（ch119）",
  "tick": 119
 },
 "evidence": [
  {
   "chapter": 119,
   "line": 34,
   "quote": "33层的构造大多是河流和浅滩，顺应着这一变化，敌人的种类也不一样了。",
   "vol": 1
  },
  {
   "chapter": 119,
   "line": 35,
   "quote": "矿物系的高防怪物减少，水栖系的怪物变多了。",
   "vol": 1
  },
  {
   "chapter": 119,
   "line": 37,
   "quote": "水系的怪物对火焰的耐性应该很强。",
   "vol": 1
  },
  {
   "chapter": 119,
   "line": 43,
   "quote": "不过就是点水，在压倒性的热量面前没有任何意义。",
   "vol": 1
  }
 ],
 "library": "setting",
 "observations": [
  {
   "category": "knowledge",
   "chapter": 119,
   "text": "迷宫层地形-怪物联动规则与火热量对水栖怪的压制实例"
  }
 ],
 "provenance": {
  "extractor": "glm-zcode-agent-v1（工单v1.2§0亲抽路线）",
  "extractor_confidence": 0.9,
  "gate_trace": [],
  "precedent_refs": [],
  "status_history": [
   {
    "by": "promotion",
    "from": "candidate",
    "to": "provisional"
   }
  ]
 },
 "record_id": "cand-setting-04ba8ecb4c10",
 "record_type": "setting",
 "status": "provisional",
 "supersedes": null,
 "verified_against": {
  "path": "迷深实战-工作区/slice/ch0119.txt",
  "sha": "09ee3441ba929c4c5e429fe2d7b08c0ec06c3c4a",
  "verified_at": "2026-09-19"
 },
 "version": 1
}