{
 "canonical": {
  "chapter": 125,
  "entities": [
   "伽鲁夫纳多杰里",
   "塞拉·雷迪安特",
   "新月琉璃制直剑",
   "相川涡波"
  ],
  "name": "BOSS魔石与锻冶新装备筹备（堪比『新月琉璃』·为塞拉备武器）",
  "note": "战前动机开环：学会『锻冶』后正值筹备新装备，Boss魔石纯度远高于一般怪物——'说不定也能打造出堪比『新月琉璃』的武器''我也想尽快为塞拉准备合适的武器'（联动ch123全员装备赠答修罗场再演预告：送装备=送礼物之修罗场）",
  "payoff_chapter": null,
  "setup_chapter": 125,
  "tier": "常规"
 },
 "evidence": [
  {
   "chapter": 125,
   "line": 31,
   "quote": "最主要的目的还是魔石。BOSS怪物掉落的魔石，比一般的怪物掉落的纯度要高很多。",
   "vol": 1
  },
  {
   "chapter": 125,
   "line": 32,
   "quote": "正好我也学会了『锻冶』技能，正值筹备新装备的时候。能得到上等的魔石的话，说不定也能打造出堪比『新月琉璃』的武器。",
   "vol": 1
  },
  {
   "chapter": 125,
   "line": 33,
   "quote": "我也想尽快为塞拉准备合适的武器。",
   "vol": 1
  }
 ],
 "library": "foreshadow",
 "observations": [
  {
   "category": "foreshadowing",
   "chapter": 125,
   "text": "开环待回收（成品待锻、塞拉武器未备）"
  }
 ],
 "provenance": {
  "extractor": "glm-zcode-agent-v1（工单v1.2§0亲抽路线）",
  "extractor_confidence": 0.85,
  "gate_trace": [],
  "precedent_refs": [],
  "status_history": [
   {
    "by": "promotion",
    "from": "candidate",
    "to": "provisional"
   }
  ]
 },
 "record_id": "cand-foreshadow-c7d1bd373bc2",
 "record_type": "foreshadow",
 "status": "provisional",
 "supersedes": null,
 "verified_against": {
  "path": "迷深实战-工作区/slice/ch0125.txt",
  "sha": "763ed1b9b7eb19c4441f2f2f7fecf13ae8aed723",
  "verified_at": "2026-09-19"
 },
 "version": 1
}