{
 "canonical": {
  "entity_type": "道具(剑)",
  "name": "阿雷亚斯家的宝剑诺文"
 },
 "evidence": [
  {
   "chapter": 80,
   "line": 968,
   "quote": "我看向『阿雷亚斯家的宝剑诺文』和玛利亚。",
   "vol": 1
  },
  {
   "chapter": 80,
   "line": 969,
   "quote": "现在这里有『地之理的盗窃者』和『火之理的盗窃者』的魔石。",
   "vol": 1
  },
  {
   "chapter": 80,
   "line": 1049,
   "quote": "我一边苦笑，一边让她看向挂在我腰间的『阿雷亚斯家的宝剑诺文』。",
   "vol": 1
  },
  {
   "chapter": 80,
   "line": 1377,
   "quote": "虽说不如『阿雷亚斯家的宝剑诺文』但是确实是大陆最高级的名剑。",
   "vol": 1
  },
  {
   "chapter": 120,
   "line": 104,
   "quote": "然而流入脑海中的却全都是『剑术』的知识。从始至终都是彻头彻尾的『剑术』",
   "vol": 1
  },
  {
   "chapter": 120,
   "line": 118,
   "quote": "不过没有得到剑的同意这点可能是最大的原因吧。",
   "vol": 1
  },
  {
   "chapter": 120,
   "line": 130,
   "quote": "从我身上溢出的次元魔术的魔力通关『阿雷亚斯家的宝剑诺文』发生了转换。",
   "vol": 1
  },
  {
   "chapter": 120,
   "line": 136,
   "quote": "此时甲板上生成了熠熠生辉的宝石长河。",
   "vol": 1
  },
  {
   "chapter": 151,
   "line": 121,
   "quote": "我看向『阿雷亚斯家的宝剑诺文』和玛利亚。",
   "vol": 1
  },
  {
   "chapter": 151,
   "line": 122,
   "quote": "现在这里有『地之理的盗窃者』和『火之理的盗窃者』的魔石。这两个魔石似乎可以抵消『世界奉还阵』的影响。帕林库洛自己也说过类似的话。",
   "vol": 1
  },
  {
   "chapter": 188,
   "line": 224,
   "quote": "「阿雷亚斯家的宝剑诺文」",
   "vol": 1
  },
  {
   "chapter": 188,
   "line": 226,
   "quote": "攻击力27",
   "vol": 1
  },
  {
   "chapter": 188,
   "line": 229,
   "quote": "可以变换形状装备者的地魔法补正+2.00",
   "vol": 1
  },
  {
   "chapter": 188,
   "line": 230,
   "quote": "看来我把这把剑给他使用的目的达成了。",
   "vol": 1
  },
  {
   "chapter": 215,
   "line": 191,
   "quote": "「还有就是剑的问题了。现在我身上一共有三把⋯⋯总之诺文必须得还给你。唯有这把剑我不能一直占用」",
   "vol": 1
  },
  {
   "chapter": 215,
   "line": 192,
   "quote": "『阿雷亚斯家的宝剑诺文』被递到了我手边。接下来我就要去挑战守护者和使徒了，所以最好可以处在随时都能使用『致亲爱的一闪』的状态。如此一来我便没有拒收的理由。",
   "vol": 1
  },
  {
   "chapter": 89,
   "line": 314,
   "quote": "我拿着『新月琉璃』，莱纳则握着『阿雷亚斯家的宝剑诺文』和『RokhBringer』",
   "vol": 1
  },
  {
   "chapter": 89,
   "line": 1290,
   "quote": "要是削去这些装饰的话还能更实用些。说得再刻薄点，这造型纯粹就是拿来看的花把势。",
   "vol": 1
  },
  {
   "chapter": 89,
   "line": 1293,
   "quote": "抱、抱歉，雷纳尔多先生。剑本人似乎不愿意这样，能不能算了呢？",
   "vol": 1
  }
 ],
 "library": "character",
 "observations": [
  {
   "category": "summary",
   "chapter": 80,
   "text": "涡波腰间现用佩剑（名冠诺文）；与玛利亚并列被指出为在场『地之理的盗窃者』『火之理的盗窃者』魔石之所在（两魔石似可抵消世界奉还阵影响）；剑之水准为大陆名剑基准（帕林库洛新佩剑自愧不如）；涡波欲请斯诺使用被拒（不怎么用剑+不擅应付诺文）"
  }
 ],
 "provenance": {
  "extractor": "glm-zcode-agent-v1（工单v1.2§0亲抽路线）",
  "extractor_confidence": 10.879999999999999,
  "gate_trace": [],
  "precedent_refs": [],
  "status_history": [
   {
    "by": "promotion",
    "from": "candidate",
    "to": "provisional"
   },
   {
    "by": "promotion",
    "from": "superseded:cand-entity-121b4652fa68",
    "to": "provisional"
   },
   {
    "by": "promotion",
    "from": "superseded:cand-entity-121b4652fa68-m",
    "to": "provisional"
   },
   {
    "by": "promotion",
    "from": "superseded:cand-entity-121b4652fa68-m3",
    "to": "provisional"
   },
   {
    "by": "promotion",
    "from": "superseded:cand-entity-121b4652fa68-m4",
    "to": "provisional"
   }
  ]
 },
 "record_id": "cand-entity-121b4652fa68-m6",
 "record_type": "entity",
 "status": "provisional",
 "supersedes": "cand-entity-121b4652fa68-m5",
 "verified_against": {
  "path": "语料分析/corpus/clean_full.txt",
  "sha": "e1a96061d25b0016094dd8daec82769ee80fc3bb",
  "verified_at": "2026-09-18"
 },
 "version": 6
}