{
 "canonical": {
  "claim": true,
  "object": "诺文",
  "rel_type": "战胜(据莱纳声称)",
  "subject": "基督"
 },
 "evidence": [
  {
   "chapter": 201,
   "line": 69,
   "quote": "但是，身为我主君的基督却战胜了诺文。",
   "vol": 1
  }
 ],
 "library": "relation",
 "observations": [
  {
   "category": "relation",
   "chapter": 201,
   "text": "据莱纳声称：『身为我主君的基督却战胜了诺文』——莱纳由此论证骑士须强于主君、以比诺文还弱的诺斯菲为对手不能赢就太不像话"
  }
 ],
 "provenance": {
  "extractor": "glm-zcode-agent-v1（工单v1.2§0亲抽路线）",
  "extractor_confidence": 0.85,
  "gate_trace": [],
  "precedent_refs": [],
  "status_history": [
   {
    "by": "promotion",
    "from": "candidate",
    "to": "provisional"
   }
  ]
 },
 "record_id": "cand-relation-7976b039fa7c",
 "record_type": "relation",
 "status": "provisional",
 "supersedes": null,
 "verified_against": {
  "path": "D:\\zcode专用！！！！危险！！！！！！！！！\\正典库构建系统\\迷深实战-工作区\\slice\\ch0201.txt",
  "sha": "e489f92f8681a8777dbe4dbdbc3fee181278f480f4aaaec6047acc1e00c33b99",
  "verified_at": "2026-09-21"
 },
 "version": 1
}