{
 "canonical": {
  "chapter": 122,
  "fact": "据诺文所言（经『编织』『诈术』习得证实）：与领域专家重复'训练/比试'行为即可习得对应技能——『魔法战斗』←与拉丝缇娅拉训练；『锻冶』←与锻冶师们比试观察；支撑=『并列思考』迅速学习＋『维度』信息处理；代价=MP与体力骤减、体温骤升；无需本人以往经验（'并没有我亲自去的必要'）",
  "name": "技能速习法（涡波·诺文论）",
  "tick": 122
 },
 "evidence": [
  {
   "chapter": 122,
   "line": 73,
   "quote": "我回想起昨天与战斗专家拉丝缇娅拉的训练中，自己学会了『魔法战斗』这个技能。也就是说，只要再重复这个行为就行了。",
   "vol": 1
  },
  {
   "chapter": 122,
   "line": 75,
   "quote": "只要在这里，从现在开始，与锻冶技术的专家们比试一番，学会技能『锻冶』就行了。",
   "vol": 1
  },
  {
   "chapter": 122,
   "line": 76,
   "quote": "既然已经学会了『编织』『诈术』，证明了诺文所言不虚，就有尝试的价值。",
   "vol": 1
  },
  {
   "chapter": 122,
   "line": 80,
   "quote": "可能是我有点性急了。虽然我知道自己能利用『并列思考』迅速学会技能，但是艾利巴茨则不然。",
   "vol": 1
  }
 ],
 "library": "setting",
 "observations": [
  {
   "category": "knowledge",
   "chapter": 122,
   "text": "知识轨更新（本章）"
  }
 ],
 "provenance": {
  "extractor": "glm-zcode-agent-v1（工单v1.2§0亲抽路线）",
  "extractor_confidence": 0.9,
  "gate_trace": [],
  "precedent_refs": [],
  "status_history": [
   {
    "by": "promotion",
    "from": "candidate",
    "to": "provisional"
   }
  ]
 },
 "record_id": "cand-setting-c7fa10f8126c",
 "record_type": "setting",
 "status": "provisional",
 "supersedes": null,
 "verified_against": {
  "path": "迷深实战-工作区/slice/ch0122.txt",
  "sha": "787bfdbfa138cef7a1ce44b7273a564e16b491b3",
  "verified_at": "2026-09-19"
 },
 "version": 1
}