{
 "canonical": {
  "chapter": 227,
  "entities": [
   "斯诺·沃克",
   "相川涡波",
   "赛鲁多拉"
  ],
  "name": "异世界同行名单（赛鲁多拉+斯诺）与危险物品入境预感",
  "note": "'等我带赛鲁多拉过去的话就把斯诺也带上'之约成立（斯诺'好棒！真让人期待！！'）；涡波不祥预感：悖道逆理的约定/如携带'非常不得了的危险物品'入境/遭我的世界的所有生物的怨恨般——斯诺入涡波世界的实态与其预感成真与否待回收",
  "payoff_chapter": null,
  "setup_chapter": 227,
  "tier": "支线"
 },
 "evidence": [
  {
   "chapter": 227,
   "line": 101,
   "quote": "「好啊，当然没关系。等我带赛鲁多拉过去的话就把斯诺也带上」",
   "vol": 1
  },
  {
   "chapter": 227,
   "line": 105,
   "quote": "怎么说呢，总觉得自己刚才好像许下了一个非常悖道逆理的约定、就仿佛会遭到我的世界的所有生物的怨恨一样⋯⋯有种莫名其妙的感觉。就好像把斯诺带到我的世界等于是携带一个非常不得了的危险物品入境那样──",
   "vol": 1
  }
 ],
 "library": "foreshadow",
 "observations": [
  {
   "category": "foreshadowing",
   "chapter": 227,
   "text": "异世界结局同行约定+不祥预感钩"
  }
 ],
 "provenance": {
  "extractor": "glm-zcode-agent-v1（工单v1.2§0亲抽路线）",
  "extractor_confidence": 0.85,
  "gate_trace": [],
  "precedent_refs": [],
  "status_history": [
   {
    "by": "promotion",
    "from": "candidate",
    "to": "provisional"
   }
  ]
 },
 "record_id": "cand-foreshadow-fb46675b41a9",
 "record_type": "foreshadow",
 "status": "provisional",
 "supersedes": null,
 "verified_against": {
  "path": "D:\\zcode专用！！！！危险！！！！！！！！！\\正典库构建系统\\迷深实战-工作区\\slice\\ch0227.txt",
  "sha": "0e004e70fbbca7d4ced61b70f9f5900d29500ac9c10a6233741e7b732094bb30",
  "verified_at": "2026-09-22"
 },
 "version": 1
}